{
  "all_signs_retained": true,
  "confirmation_read_count": 1,
  "evaluation_attempt_count": 1,
  "manifest_sha256": "c80977d6128e403a308f0ad4552050083c3d79a0593af7dc94d97aecab740ced",
  "outcome_read_count": 2,
  "outputs": {
    "evaluation_panel": {
      "logical_path": "MDS650_B1V3_DATA_ROOT/evaluation/evaluation_panel.parquet",
      "rows": 34897,
      "sha256": "d688000d86d5752ab5d553d4616f7ea94f301f7e148b81c1aa2044e16db6d3dd"
    },
    "primary_forecasts": {
      "logical_path": "MDS650_B1V3_DATA_ROOT/evaluation/primary_forecasts.parquet",
      "rows": 69462,
      "sha256": "a3fd362db6b34cf53225b76f37132174298a421afa754dff4563422b552a496c"
    },
    "timing_forecasts": {
      "logical_path": "MDS650_B1V3_DATA_ROOT/evaluation/timing_forecasts.parquet",
      "rows": 345642,
      "sha256": "96b8fde4b23eab8de35e6700c5a70788d610a271140f4b446222803971b67e2d"
    }
  },
  "sample": {
    "asset_count": 6,
    "confirmation_rows": 11577,
    "confirmation_sessions": 30,
    "origin_identity_sha256": "856475796eb5a0f7014bc61e45439b6459f1980b41b63301933f2edb020b5a79",
    "target_identity_sha256": "a706e3cbc6274053af706617be59024d8a0a77f3bc6a3cb39c4e102ce5c7dbde",
    "training_rows": 23320,
    "training_sessions": 60
  },
  "schema_version": "1.0",
  "scientific_result": {
    "all_signs_retained": true,
    "claims": {
      "delta_b1v3": {
        "conditions": {
          "all_registered_timing_views_present": true,
          "at_least_four_assets_positive": false,
          "effect_meets_training_mde": false,
          "gamma_estimate_positive": false,
          "gamma_interval_above_zero": false,
          "holm_adjusted_p_below_0_05": true,
          "lightgbm_sign_positive": false,
          "no_more_than_one_asset_interval_below_zero": false,
          "no_timing_interval_wholly_below_zero": false
        },
        "failed_conditions": [
          "gamma_estimate_positive",
          "gamma_interval_above_zero",
          "effect_meets_training_mde",
          "lightgbm_sign_positive",
          "at_least_four_assets_positive",
          "no_more_than_one_asset_interval_below_zero",
          "no_timing_interval_wholly_below_zero"
        ],
        "mde": 0.01890532256795044,
        "status": "GLOBAL_EDGE_NOT_CONFIRMED"
      },
      "delta_b2": {
        "conditions": {
          "all_registered_timing_views_present": true,
          "at_least_four_assets_positive": true,
          "effect_meets_training_mde": true,
          "gamma_estimate_positive": true,
          "gamma_interval_above_zero": true,
          "holm_adjusted_p_below_0_05": true,
          "lightgbm_sign_positive": false,
          "no_more_than_one_asset_interval_below_zero": true,
          "no_timing_interval_wholly_below_zero": true
        },
        "failed_conditions": [
          "lightgbm_sign_positive"
        ],
        "mde": 0.013041821324764561,
        "status": "POSITIVE_BUT_NOT_GLOBALLY_CONFIRMED"
      }
    },
    "decision": "POSITIVE_BUT_NOT_GLOBALLY_CONFIRMED",
    "global": {
      "gamma_glm_confirmatory": {
        "delta_b1v3": {
          "baseline_mean_qlike": 0.4069971984916822,
          "ci_high": -0.03593304271525962,
          "ci_low": -0.06532898193289274,
          "clusters": 30,
          "contrast": "delta_b1v3",
          "definition": "QLIKE(B0)-QLIKE(B1v3a)",
          "estimate": -0.05030241655550208,
          "expanded_mean_qlike": 0.45729961504718425,
          "model_role": "gamma_glm_confirmatory",
          "observations": 11577,
          "p_value_holm": 0.00039996000399960006,
          "p_value_raw": 0.00019998000199980003,
          "p_value_two_sided": 0.00019998000199980003,
          "positive_direction": "EXPANDED_INFORMATION_SET_BETTER",
          "repetitions": 10000,
          "result_sign": "NEGATIVE",
          "seed": 650
        },
        "delta_b2": {
          "baseline_mean_qlike": 0.45729961504718425,
          "ci_high": 0.06817331887662217,
          "ci_low": 0.03857849271713776,
          "clusters": 30,
          "contrast": "delta_b2",
          "definition": "QLIKE(B1v3a)-QLIKE(B2)",
          "estimate": 0.05339190143807001,
          "expanded_mean_qlike": 0.40390771360911426,
          "model_role": "gamma_glm_confirmatory",
          "observations": 11577,
          "p_value_holm": 0.00039996000399960006,
          "p_value_raw": 0.00019998000199980003,
          "p_value_two_sided": 0.00019998000199980003,
          "positive_direction": "EXPANDED_INFORMATION_SET_BETTER",
          "repetitions": 10000,
          "result_sign": "POSITIVE",
          "seed": 650
        }
      },
      "lightgbm_robustness": {
        "delta_b1v3": {
          "baseline_mean_qlike": 0.13666787970674368,
          "ci_high": -0.005105046455186725,
          "ci_low": -0.03410386017999475,
          "clusters": 30,
          "contrast": "delta_b1v3",
          "definition": "QLIKE(B0)-QLIKE(B1v3a)",
          "estimate": -0.01620931597449301,
          "expanded_mean_qlike": 0.15287719568123667,
          "model_role": "lightgbm_robustness",
          "observations": 11577,
          "p_value_raw": 0.00019998000199980003,
          "p_value_two_sided": 0.00019998000199980003,
          "positive_direction": "EXPANDED_INFORMATION_SET_BETTER",
          "repetitions": 10000,
          "result_sign": "NEGATIVE",
          "seed": 650
        },
        "delta_b2": {
          "baseline_mean_qlike": 0.15287719568123667,
          "ci_high": -0.0035503902205387262,
          "ci_low": -0.01218465979335958,
          "clusters": 30,
          "contrast": "delta_b2",
          "definition": "QLIKE(B1v3a)-QLIKE(B2)",
          "estimate": -0.007452814126084585,
          "expanded_mean_qlike": 0.1603300098073213,
          "model_role": "lightgbm_robustness",
          "observations": 11577,
          "p_value_raw": 0.00019998000199980003,
          "p_value_two_sided": 0.00019998000199980003,
          "positive_direction": "EXPANDED_INFORMATION_SET_BETTER",
          "repetitions": 10000,
          "result_sign": "NEGATIVE",
          "seed": 650
        }
      }
    },
    "global_holm": {
      "delta_b1v3": 0.00039996000399960006,
      "delta_b2": 0.00039996000399960006
    },
    "metrics": [
      {
        "information_set": "B0",
        "mae": 8.882291184534523e-06,
        "model_role": "gamma_glm_confirmatory",
        "observations": 11577,
        "qlike": 0.4069971984916822,
        "rmse": 2.4107077195646266e-05
      },
      {
        "information_set": "B1v3a",
        "mae": 9.063666716433467e-06,
        "model_role": "gamma_glm_confirmatory",
        "observations": 11577,
        "qlike": 0.45729961504718425,
        "rmse": 2.4652476494746922e-05
      },
      {
        "information_set": "B2",
        "mae": 8.84005163700208e-06,
        "model_role": "gamma_glm_confirmatory",
        "observations": 11577,
        "qlike": 0.40390771360911426,
        "rmse": 2.4409772120793053e-05
      },
      {
        "information_set": "B0",
        "mae": 5.86237201976444e-06,
        "model_role": "lightgbm_robustness",
        "observations": 11577,
        "qlike": 0.13666787970674368,
        "rmse": 1.518463487584056e-05
      },
      {
        "information_set": "B1v3a",
        "mae": 5.91563967949046e-06,
        "model_role": "lightgbm_robustness",
        "observations": 11577,
        "qlike": 0.15287719568123667,
        "rmse": 1.5211994579989153e-05
      },
      {
        "information_set": "B2",
        "mae": 5.954981920970516e-06,
        "model_role": "lightgbm_robustness",
        "observations": 11577,
        "qlike": 0.1603300098073213,
        "rmse": 1.5528580705165626e-05
      }
    ],
    "stability": [
      {
        "baseline_mean_qlike": 0.1874818753415309,
        "ci_high": 0.02883140824886079,
        "ci_low": 0.008217113046128066,
        "clusters": 30,
        "contrast": "delta_b1v3",
        "definition": "QLIKE(B0)-QLIKE(B1v3a)",
        "dimension": "asset",
        "estimate": 0.018930000343357734,
        "expanded_mean_qlike": 0.16855187499817317,
        "model_role": "gamma_glm_confirmatory",
        "observations": 1913,
        "p_value_raw": 0.0007999200079992001,
        "p_value_two_sided": 0.0007999200079992001,
        "positive_direction": "EXPANDED_INFORMATION_SET_BETTER",
        "repetitions": 10000,
        "result_sign": "POSITIVE",
        "seed": 650,
        "status": "ESTIMATED",
        "value": "AAPL"
      },
      {
        "baseline_mean_qlike": 0.2029235645974409,
        "ci_high": -0.02593115700498869,
        "ci_low": -0.056025592366584546,
        "clusters": 30,
        "contrast": "delta_b1v3",
        "definition": "QLIKE(B0)-QLIKE(B1v3a)",
        "dimension": "asset",
        "estimate": -0.040417798960456025,
        "expanded_mean_qlike": 0.24334136355789693,
        "model_role": "gamma_glm_confirmatory",
        "observations": 1927,
        "p_value_raw": 0.00019998000199980003,
        "p_value_two_sided": 0.00019998000199980003,
        "positive_direction": "EXPANDED_INFORMATION_SET_BETTER",
        "repetitions": 10000,
        "result_sign": "NEGATIVE",
        "seed": 650,
        "status": "ESTIMATED",
        "value": "AMZN"
      },
      {
        "baseline_mean_qlike": 0.12975880840019502,
        "ci_high": -0.0006129386663395338,
        "ci_low": -0.019963716609716107,
        "clusters": 30,
        "contrast": "delta_b1v3",
        "definition": "QLIKE(B0)-QLIKE(B1v3a)",
        "dimension": "asset",
        "estimate": -0.009915196760222731,
        "expanded_mean_qlike": 0.13967400516041772,
        "model_role": "gamma_glm_confirmatory",
        "observations": 1941,
        "p_value_raw": 0.036996300369963,
        "p_value_two_sided": 0.036996300369963,
        "positive_direction": "EXPANDED_INFORMATION_SET_BETTER",
        "repetitions": 10000,
        "result_sign": "NEGATIVE",
        "seed": 650,
        "status": "ESTIMATED",